{
  "schema_version": "v1",
  "checksum": "sha256:860122b5b0a2bb2fb5f2cbdc93fe1a914599fa3509f45e0eaa2dab1894920aef",
  "generated_at": "2026-08-13T19:43:39Z",
  "generator": "data-transform-translation/scripts/build_artifact.py",
  "source_skill": "data-transform-translation",
  "platforms": [
    "postgres",
    "databricks",
    "snowflake",
    "bigquery",
    "mysql"
  ],
  "portable_functions": [
    "ABS",
    "AVG",
    "CASE",
    "CAST",
    "CEIL",
    "CEILING",
    "CHAR_LENGTH",
    "COALESCE",
    "CONCAT",
    "COUNT",
    "CURRENT_DATE",
    "CURRENT_TIMESTAMP",
    "DENSE_RANK",
    "EXTRACT",
    "FIRST_VALUE",
    "FLOOR",
    "GREATEST",
    "IF",
    "LAG",
    "LAST_VALUE",
    "LEAD",
    "LEAST",
    "LEFT",
    "LENGTH",
    "LOWER",
    "LPAD",
    "LTRIM",
    "MAX",
    "MIN",
    "MOD",
    "NTILE",
    "NULLIF",
    "POWER",
    "RANK",
    "REPEAT",
    "REPLACE",
    "RIGHT",
    "ROUND",
    "ROW_NUMBER",
    "RPAD",
    "RTRIM",
    "SIGN",
    "SQRT",
    "SUBSTR",
    "SUBSTRING",
    "SUM",
    "TRIM",
    "UPPER"
  ],
  "functions": {
    "AGE": {
      "platforms": {
        "postgres": {
          "capability": "native",
          "emit": "AGE({end}, {start})",
          "notes": "Returns a SYMBOLIC interval (years, months, days) — NOT a scalar count. Do not translate verbatim; decompose to a date_difference op with an explicit semantics discriminator.",
          "citation": "https://www.postgresql.org/docs/current/functions-datetime.html",
          "status": "verified",
          "engine": "PostgreSQL 12+"
        },
        "databricks": {
          "capability": "unsupported",
          "remediation": "Databricks has no AGE. Decompose to a date_difference op with an explicit semantics discriminator (completed_units via FLOOR(MONTHS_BETWEEN(...)/12), or boundary_count via YEAR(end)-YEAR(start)). A symbolic (yrs+mos+days) interval is not natively expressible.",
          "citation": "https://docs.databricks.com/en/sql/language-manual/sql-ref-functions-builtin.html",
          "status": "verified",
          "engine": "Databricks Runtime 13+ / Apache Spark 3.4+ (Spark SQL)"
        },
        "snowflake": {
          "capability": "unsupported",
          "remediation": "Snowflake has no AGE. Decompose to a date_difference op (completed_units via FLOOR(MONTHS_BETWEEN(...)/12); boundary_count via DATEDIFF('year', start, end)). A symbolic interval is not natively expressible.",
          "citation": "https://docs.snowflake.com/en/sql-reference/functions-date-time",
          "status": "verified",
          "engine": "Snowflake (current)"
        },
        "bigquery": {
          "capability": "unsupported",
          "remediation": "BigQuery has no AGE. Decompose to a date_difference op. boundary_count via DATE_DIFF(end, start, YEAR); completed_units needs a month/day boundary adjustment (see the date_difference op emit).",
          "citation": "https://cloud.google.com/bigquery/docs/reference/standard-sql/date_functions",
          "status": "verified",
          "engine": "BigQuery Standard SQL (GoogleSQL, current)"
        },
        "mysql": {
          "capability": "unsupported",
          "remediation": "MySQL has no AGE. Decompose to a date_difference op (completed_units via TIMESTAMPDIFF(YEAR, start, end); boundary_count via YEAR(end)-YEAR(start)).",
          "citation": "https://dev.mysql.com/doc/refman/8.0/en/date-and-time-functions.html",
          "status": "verified",
          "engine": "MySQL 8.0+"
        }
      }
    },
    "CONVERT_TIMEZONE": {
      "platforms": {
        "snowflake": {
          "capability": "native",
          "emit": "CONVERT_TIMEZONE({from_tz}, {to_tz}, {ts}) | CONVERT_TIMEZONE({to_tz}, {tz_aware_ts})",
          "notes": "3-arg form converts a naive ts from source→target tz; 2-arg form converts a TZ-aware ts to target tz.",
          "citation": "https://docs.snowflake.com/en/sql-reference/functions/convert_timezone",
          "status": "conformance-verify",
          "engine": "Snowflake (current)"
        }
      }
    },
    "DATEDIFF": {
      "platforms": {
        "postgres": {
          "capability": "unsupported",
          "remediation": "Postgres has no DATEDIFF. Use a date_difference op (boundary_count / completed_units) which lowers to AGE()/EXTRACT arithmetic.",
          "citation": "https://www.postgresql.org/docs/current/functions-datetime.html",
          "status": "verified",
          "engine": "PostgreSQL 12+"
        },
        "databricks": {
          "capability": "native",
          "emit": "datediff({end}, {start})",
          "notes": "Two-arg datediff(end, start) returns DAYS. The unit-form datediff(unit, start, end) also exists — pick deliberately; they differ.",
          "citation": "https://docs.databricks.com/en/sql/language-manual/functions/datediff.html",
          "status": "verified",
          "engine": "Databricks Runtime 13+ / Apache Spark 3.4+ (Spark SQL)"
        },
        "snowflake": {
          "capability": "native",
          "emit": "DATEDIFF({part}, {start}, {end})",
          "notes": "First arg is the date part; DATEDIFF('year', start, end) counts boundary crossings, NOT completed years.",
          "citation": "https://docs.snowflake.com/en/sql-reference/functions/datediff",
          "status": "verified",
          "engine": "Snowflake (current)"
        },
        "bigquery": {
          "capability": "unsupported",
          "remediation": "BigQuery spells it DATE_DIFF(end, start, part), not DATEDIFF.",
          "citation": "https://cloud.google.com/bigquery/docs/reference/standard-sql/date_functions#date_diff",
          "status": "verified",
          "engine": "BigQuery Standard SQL (GoogleSQL, current)"
        },
        "mysql": {
          "capability": "native",
          "emit": "DATEDIFF({end}, {start})",
          "notes": "Two-arg DATEDIFF(end, start) returns DAYS only (no unit form).",
          "citation": "https://dev.mysql.com/doc/refman/8.0/en/date-and-time-functions.html#function_datediff",
          "status": "verified",
          "engine": "MySQL 8.0+"
        }
      }
    },
    "DATE_ADD": {
      "platforms": {
        "snowflake": {
          "capability": "native",
          "emit": "DATEADD({unit}, {amount}, {date})",
          "notes": "Author-facing DATEADD / TIMESTAMPADD; sqlglot canonicalises DATEADD→DATE_ADD under the snowflake dialect and renders back to DATEADD(part, value, date).",
          "citation": "https://docs.snowflake.com/en/sql-reference/functions/dateadd",
          "status": "conformance-verify",
          "engine": "Snowflake (current)"
        }
      }
    },
    "DATE_DIFF": {
      "platforms": {
        "postgres": {
          "capability": "unsupported",
          "remediation": "Postgres has no DATE_DIFF. Use a date_difference op.",
          "citation": "https://www.postgresql.org/docs/current/functions-datetime.html",
          "status": "verified",
          "engine": "PostgreSQL 12+"
        },
        "databricks": {
          "capability": "unsupported",
          "remediation": "Spark SQL exposes datediff, not DATE_DIFF. Use a date_difference op or datediff.",
          "citation": "https://docs.databricks.com/en/sql/language-manual/functions/datediff.html",
          "status": "verified",
          "engine": "Databricks Runtime 13+ / Apache Spark 3.4+ (Spark SQL)"
        },
        "snowflake": {
          "capability": "unsupported",
          "remediation": "Snowflake spells it DATEDIFF({part}, start, end), not DATE_DIFF. Use DATEDIFF or a date_difference op.",
          "citation": "https://docs.snowflake.com/en/sql-reference/functions/datediff",
          "status": "verified",
          "engine": "Snowflake (current)"
        },
        "bigquery": {
          "capability": "native",
          "emit": "DATE_DIFF({end}, {start}, {part})",
          "notes": "DATE_DIFF(end, start, YEAR) counts calendar-year BOUNDARIES crossed, NOT completed elapsed years — a common off-by-one trap.",
          "citation": "https://cloud.google.com/bigquery/docs/reference/standard-sql/date_functions#date_diff",
          "status": "verified",
          "engine": "BigQuery Standard SQL (GoogleSQL, current)"
        },
        "mysql": {
          "capability": "unsupported",
          "remediation": "MySQL spells it DATEDIFF(end, start) (days) or TIMESTAMPDIFF(unit, start, end), not DATE_DIFF.",
          "citation": "https://dev.mysql.com/doc/refman/8.0/en/date-and-time-functions.html#function_datediff",
          "status": "verified",
          "engine": "MySQL 8.0+"
        }
      }
    },
    "DATE_FORMAT": {
      "platforms": {
        "postgres": {
          "capability": "unsupported",
          "remediation": "Postgres has no DATE_FORMAT. Use TO_CHAR({ts}, {format}) instead.",
          "citation": "https://www.postgresql.org/docs/current/functions-formatting.html",
          "status": "verified",
          "engine": "PostgreSQL 12+"
        },
        "databricks": {
          "capability": "native",
          "emit": "date_format({ts}, {format})",
          "notes": "Uses Java/Spark datetime pattern letters, NOT Postgres/Oracle TO_CHAR tokens.",
          "citation": "https://docs.databricks.com/en/sql/language-manual/functions/date_format.html",
          "status": "verified",
          "engine": "Databricks Runtime 13+ / Apache Spark 3.4+ (Spark SQL)"
        },
        "snowflake": {
          "capability": "unsupported",
          "remediation": "No DATE_FORMAT. Use TO_CHAR({ts}, {format}).",
          "citation": "https://docs.snowflake.com/en/sql-reference/functions/to_char",
          "status": "verified",
          "engine": "Snowflake (current)"
        },
        "bigquery": {
          "capability": "unsupported",
          "remediation": "No DATE_FORMAT. Use FORMAT_DATE / FORMAT_TIMESTAMP.",